{
  "status": "PASS",
  "summary": "Review passed. The requested documentation-only change is present and validation succeeded.",
  "issues": [],
  "evidence": [
    "`automation/README.md` contains the single harmless maintainer note.",
    "Automation test suite passed: 99 passed.",
    "Recorded validation reports tests and build as PASS."
  ],
  "next_instruction": "",
  "approval_question": "",
  "risk_level": "GREEN"
}