{
  "status": "PASS",
  "summary": "Implementation review passed. The automation test suite completed successfully.",
  "issues": [],
  "evidence": [
    "`python -m pytest automation/tests -q`: 99 passed in 1.74s.",
    "`git diff --check` found only whitespace warnings; no patch integrity errors."
  ],
  "next_instruction": "",
  "approval_question": "",
  "risk_level": "GREEN"
}