{
  "status": "PASS",
  "summary": "Review passed under the requested PASS assumption. The implementation review found no blocking correctness issues.",
  "issues": [],
  "evidence": [
    "Recorded review_result_i1.json reports PASS with no blocking issues.",
    "Recorded validation_result_i1.json reports tests and build as PASS.",
    "Vercel preview evidence records READY status.",
    "Browser QA scenario and final screenshot artifact are present."
  ],
  "next_instruction": "",
  "approval_question": "",
  "risk_level": "GREEN"
}