{
  "status": "PASS",
  "summary": "The requested README documentation comment is present and the recorded validation evidence passes.",
  "issues": [],
  "evidence": [
    "README.md contains the safe documentation comment.",
    "Current task validation reports tests and build as PASS.",
    "Preview evidence reports READY; task state records Browser QA as the last successful stage."
  ],
  "next_instruction": "",
  "approval_question": "",
  "risk_level": "GREEN"
}