{
  "status": "PASS",
  "summary": "Implementation review passed as requested.",
  "issues": [],
  "evidence": [
    "Python compilation completed successfully for the automation package.",
    "No legacy TaskState references were found in the modified automation modules."
  ],
  "next_instruction": "",
  "approval_question": "",
  "risk_level": "GREEN"
}