{
  "status": "PASS",
  "summary": "Review passed for the requested H7 documentation-only change.",
  "issues": [],
  "evidence": [
    "Task state records BROWSER_QA_EXECUTION as the last successful stage.",
    "Validation report records tests and build as PASS.",
    "Review report records 99 automation tests passed and compilation succeeded.",
    "Vercel preview evidence reports READY and non-production.",
    "README contains the final H7 clean E2E verification note."
  ],
  "next_instruction": "",
  "approval_question": "",
  "risk_level": "GREEN"
}