{
  "status": "REVISE",
  "summary": "Approval-driven workflows cannot progress through the supervisor, and terminal approval/commit/push transitions are not persisted. The DB/deployment/browser-QA stages are also currently no-op state transitions.",
  "issues": [
    "`Supervisor.loop_once()` has no `WAITING_FOR_USER_APPROVAL` branch, so after `control approve` leaves a task in that state, the worker is never relaunched to execute `main.py`'s resume logic (supervisor.py:151-169; main.py:79-105).",
    "`main.py` changes state then `break`s before the sole `runtime.save_state(state)` call for COMMIT approval, PUSH approval, and completion. The persisted state remains stale, causing duplicate approval requests/commits or preventing completion persistence (main.py:216-241).",
    "DB inspection, preview deployment, browser-QA planning/execution, and final review only advance enum values; no DB adapter/executor, Vercel adapter, or Browser adapter is invoked. A task can reach commit approval without those required checks actually running (main.py:201-214)."
  ],
  "evidence": [
    "`python -m compileall -q automation` passed.",
    "`python -m pytest -q automation/tests` passed: 99 tests.",
    "Repository-root `pytest` fails collection due to unrelated root scripts and backend tests lacking their expected `app` import path."
  ],
  "next_instruction": "Persist state before every break/return, add supervisor handling to relaunch approved waiting tasks, implement and gate the DB/deploy/browser QA stages on real results, and add end-to-end tests for approval resumption and persistence.",
  "approval_question": "",
  "risk_level": "RED"
}