{
  "status": "PASS",
  "summary": "Implementation review passed. The queued-task workflow, approval handling, staged validation, preview safety guard, browser-QA stages, and supervisor locking compile and are covered by the current test suite.",
  "issues": [],
  "evidence": [
    "`python -m pytest automation/tests -q`: 99 passed.",
    "`python -m compileall -q automation`: completed successfully.",
    "Reviewed the changed runtime-state, control, state-machine, supervisor, Vercel adapter, and orchestration paths."
  ],
  "next_instruction": "",
  "approval_question": "",
  "risk_level": "GREEN"
}